
         /\      Grafana   /‾‾/  
    /\  /  \     |\  __   /  /   
   /  \/    \    | |/ /  /   ‾‾\ 
  /          \   |   (  |  (‾)  |
 / __________ \  |_|\_\  \_____/ 

     execution: local
        script: query-test.js
        output: Prometheus remote write (http://prometheus-user-workload.openshift-user-workload-monitoring.svc:9091/api/v1/write)

     scenarios: (100.00%) 1 scenario, 20 max VUs, 5m30s max duration (incl. graceful stop):
              * queries: 5.00 iterations/s for 5m0s (maxVUs: 5-20, gracefulStop: 30s)

time="2026-01-02T15:43:17Z" level=info msg="\n================================================================================\n  TEMPO QUERY PERFORMANCE TEST\n================================================================================\n  Size:              medium\n  Description:       Moderate load - typical production baseline\n  Queries/second:    5\n  Duration:          5m\n  VUs:               5 - 20\n  Endpoint:          https://tempo-tempostack-gateway.tempo-perf-small.svc.cluster.local:8080/api/traces/v1/tenant-1/tempo (Tempo Gateway)\n  Tenant:            tenant-1\n  TLS:               enabled\n  Query Count:       11 different queries\n  Trace Fetch Prob:  10%\n================================================================================\n" source=console
time="2026-01-02T15:43:17Z" level=error msg="GoError: HTTP error 502: \n\tat reflect.methodValueCall (native)\n\tat default (file:///scripts/query-test.js:122:33(38))\n" executor=constant-arrival-rate scenario=queries source=stacktrace
time="2026-01-02T15:43:17Z" level=error msg="GoError: HTTP error 502: \n\tat reflect.methodValueCall (native)\n\tat default (file:///scripts/query-test.js:122:33(38))\n" executor=constant-arrival-rate scenario=queries source=stacktrace
time="2026-01-02T15:43:17Z" level=error msg="GoError: HTTP error 502: \n\tat reflect.methodValueCall (native)\n\tat default (file:///scripts/query-test.js:122:33(38))\n" executor=constant-arrival-rate scenario=queries source=stacktrace
time="2026-01-02T15:43:17Z" level=error msg="GoError: HTTP error 502: \n\tat reflect.methodValueCall (native)\n\tat default (file:///scripts/query-test.js:122:33(38))\n" executor=constant-arrival-rate scenario=queries source=stacktrace
time="2026-01-02T15:43:17Z" level=error msg="GoError: HTTP error 502: \n\tat reflect.methodValueCall (native)\n\tat default (file:///scripts/query-test.js:122:33(38))\n" executor=constant-arrival-rate scenario=queries source=stacktrace

running (0m01.0s), 00/05 VUs, 5 complete and 0 interrupted iterations
queries   [   0% ] 00/05 VUs  0m01.0s/5m0s  5.00 iters/s
time="2026-01-02T15:43:18Z" level=error msg="GoError: HTTP error 502: \n\tat reflect.methodValueCall (native)\n\tat default (file:///scripts/query-test.js:122:33(38))\n" executor=constant-arrival-rate scenario=queries source=stacktrace
time="2026-01-02T15:43:18Z" level=error msg="GoError: HTTP error 502: \n\tat reflect.methodValueCall (native)\n\tat default (file:///scripts/query-test.js:122:33(38))\n" executor=constant-arrival-rate scenario=queries source=stacktrace
time="2026-01-02T15:43:18Z" level=error msg="GoError: HTTP error 502: \n\tat reflect.methodValueCall (native)\n\tat default (file:///scripts/query-test.js:122:33(38))\n" executor=constant-arrival-rate scenario=queries source=stacktrace
time="2026-01-02T15:43:18Z" level=error msg="GoError: HTTP error 502: \n\tat reflect.methodValueCall (native)\n\tat default (file:///scripts/query-test.js:122:33(38))\n" executor=constant-arrival-rate scenario=queries source=stacktrace
time="2026-01-02T15:43:18Z" level=error msg="GoError: HTTP error 502: \n\tat reflect.methodValueCall (native)\n\tat default (file:///scripts/query-test.js:122:33(38))\n" executor=constant-arrival-rate scenario=queries source=stacktrace

running (0m02.0s), 00/05 VUs, 10 complete and 0 interrupted iterations
queries   [   1% ] 00/05 VUs  0m02.0s/5m0s  5.00 iters/s

running (0m03.0s), 00/05 VUs, 15 complete and 0 interrupted iterations
queries   [   1% ] 00/05 VUs  0m03.0s/5m0s  5.00 iters/s

running (0m04.0s), 00/05 VUs, 20 complete and 0 interrupted iterations
queries   [   1% ] 00/05 VUs  0m04.0s/5m0s  5.00 iters/s

running (0m05.0s), 00/05 VUs, 25 complete and 0 interrupted iterations
queries   [   2% ] 00/05 VUs  0m05.0s/5m0s  5.00 iters/s

running (0m06.0s), 00/05 VUs, 30 complete and 0 interrupted iterations
queries   [   2% ] 00/05 VUs  0m06.0s/5m0s  5.00 iters/s
time="2026-01-02T15:43:23Z" level=error msg="Failed to send the time series data to the endpoint" error="read tcp 10.217.1.148:52348->10.217.5.249:9091: read: connection reset by peer" output="Prometheus remote write"

running (0m07.0s), 00/05 VUs, 35 complete and 0 interrupted iterations
queries   [   2% ] 00/05 VUs  0m07.0s/5m0s  5.00 iters/s

running (0m08.0s), 00/05 VUs, 40 complete and 0 interrupted iterations
queries   [   3% ] 00/05 VUs  0m08.0s/5m0s  5.00 iters/s

running (0m09.0s), 00/05 VUs, 45 complete and 0 interrupted iterations
queries   [   3% ] 00/05 VUs  0m09.0s/5m0s  5.00 iters/s

running (0m10.0s), 00/05 VUs, 50 complete and 0 interrupted iterations
queries   [   3% ] 00/05 VUs  0m10.0s/5m0s  5.00 iters/s
time="2026-01-02T15:43:27Z" level=error msg="Failed to send the time series data to the endpoint" error="got status code: 400 instead expected a 2xx successful status code" output="Prometheus remote write"

running (0m11.0s), 00/05 VUs, 55 complete and 0 interrupted iterations
queries   [   4% ] 00/05 VUs  0m11.0s/5m0s  5.00 iters/s

running (0m12.0s), 00/05 VUs, 60 complete and 0 interrupted iterations
queries   [   4% ] 00/05 VUs  0m12.0s/5m0s  5.00 iters/s

running (0m13.0s), 00/05 VUs, 65 complete and 0 interrupted iterations
queries   [   4% ] 00/05 VUs  0m13.0s/5m0s  5.00 iters/s

running (0m14.0s), 00/05 VUs, 70 complete and 0 interrupted iterations
queries   [   5% ] 00/05 VUs  0m14.0s/5m0s  5.00 iters/s

running (0m15.0s), 00/05 VUs, 75 complete and 0 interrupted iterations
queries   [   5% ] 00/05 VUs  0m15.0s/5m0s  5.00 iters/s
time="2026-01-02T15:43:32Z" level=error msg="Failed to send the time series data to the endpoint" error="got status code: 400 instead expected a 2xx successful status code" output="Prometheus remote write"

running (0m16.0s), 00/05 VUs, 80 complete and 0 interrupted iterations
queries   [   5% ] 00/05 VUs  0m16.0s/5m0s  5.00 iters/s

running (0m17.0s), 00/05 VUs, 85 complete and 0 interrupted iterations
queries   [   6% ] 00/05 VUs  0m17.0s/5m0s  5.00 iters/s

running (0m18.0s), 00/05 VUs, 90 complete and 0 interrupted iterations
queries   [   6% ] 00/05 VUs  0m18.0s/5m0s  5.00 iters/s

running (0m19.0s), 00/05 VUs, 95 complete and 0 interrupted iterations
queries   [   6% ] 00/05 VUs  0m19.0s/5m0s  5.00 iters/s

running (0m20.0s), 00/05 VUs, 100 complete and 0 interrupted iterations
queries   [   7% ] 00/05 VUs  0m20.0s/5m0s  5.00 iters/s
time="2026-01-02T15:43:37Z" level=error msg="Failed to send the time series data to the endpoint" error="got status code: 400 instead expected a 2xx successful status code" output="Prometheus remote write"

running (0m21.0s), 00/05 VUs, 105 complete and 0 interrupted iterations
queries   [   7% ] 00/05 VUs  0m21.0s/5m0s  5.00 iters/s

running (0m22.0s), 00/05 VUs, 110 complete and 0 interrupted iterations
queries   [   7% ] 00/05 VUs  0m22.0s/5m0s  5.00 iters/s

running (0m23.0s), 00/05 VUs, 115 complete and 0 interrupted iterations
queries   [   8% ] 00/05 VUs  0m23.0s/5m0s  5.00 iters/s

running (0m24.0s), 00/05 VUs, 120 complete and 0 interrupted iterations
queries   [   8% ] 00/05 VUs  0m24.0s/5m0s  5.00 iters/s

running (0m25.0s), 00/05 VUs, 125 complete and 0 interrupted iterations
queries   [   8% ] 00/05 VUs  0m25.0s/5m0s  5.00 iters/s
time="2026-01-02T15:43:42Z" level=error msg="Failed to send the time series data to the endpoint" error="got status code: 400 instead expected a 2xx successful status code" output="Prometheus remote write"

running (0m26.0s), 00/05 VUs, 130 complete and 0 interrupted iterations
queries   [   9% ] 00/05 VUs  0m26.0s/5m0s  5.00 iters/s

running (0m27.0s), 00/05 VUs, 135 complete and 0 interrupted iterations
queries   [   9% ] 00/05 VUs  0m27.0s/5m0s  5.00 iters/s

running (0m28.0s), 00/05 VUs, 140 complete and 0 interrupted iterations
queries   [   9% ] 00/05 VUs  0m28.0s/5m0s  5.00 iters/s

running (0m29.0s), 00/05 VUs, 145 complete and 0 interrupted iterations
queries   [  10% ] 00/05 VUs  0m29.0s/5m0s  5.00 iters/s

running (0m30.0s), 00/05 VUs, 150 complete and 0 interrupted iterations
queries   [  10% ] 00/05 VUs  0m30.0s/5m0s  5.00 iters/s
time="2026-01-02T15:43:47Z" level=error msg="Failed to send the time series data to the endpoint" error="got status code: 400 instead expected a 2xx successful status code" output="Prometheus remote write"

running (0m31.0s), 00/05 VUs, 155 complete and 0 interrupted iterations
queries   [  10% ] 00/05 VUs  0m31.0s/5m0s  5.00 iters/s

running (0m32.0s), 00/05 VUs, 160 complete and 0 interrupted iterations
queries   [  11% ] 00/05 VUs  0m32.0s/5m0s  5.00 iters/s

running (0m33.0s), 00/05 VUs, 165 complete and 0 interrupted iterations
queries   [  11% ] 00/05 VUs  0m33.0s/5m0s  5.00 iters/s

running (0m34.0s), 00/05 VUs, 170 complete and 0 interrupted iterations
queries   [  11% ] 00/05 VUs  0m34.0s/5m0s  5.00 iters/s

running (0m35.0s), 00/05 VUs, 175 complete and 0 interrupted iterations
queries   [  12% ] 00/05 VUs  0m35.0s/5m0s  5.00 iters/s
time="2026-01-02T15:43:52Z" level=error msg="Failed to send the time series data to the endpoint" error="got status code: 400 instead expected a 2xx successful status code" output="Prometheus remote write"

running (0m36.0s), 00/05 VUs, 180 complete and 0 interrupted iterations
queries   [  12% ] 00/05 VUs  0m36.0s/5m0s  5.00 iters/s

running (0m37.0s), 00/05 VUs, 185 complete and 0 interrupted iterations
queries   [  12% ] 00/05 VUs  0m37.0s/5m0s  5.00 iters/s

running (0m38.0s), 00/05 VUs, 190 complete and 0 interrupted iterations
queries   [  13% ] 00/05 VUs  0m38.0s/5m0s  5.00 iters/s

running (0m39.0s), 00/05 VUs, 195 complete and 0 interrupted iterations
queries   [  13% ] 00/05 VUs  0m39.0s/5m0s  5.00 iters/s

running (0m40.0s), 00/05 VUs, 200 complete and 0 interrupted iterations
queries   [  13% ] 00/05 VUs  0m40.0s/5m0s  5.00 iters/s
time="2026-01-02T15:43:57Z" level=error msg="Failed to send the time series data to the endpoint" error="got status code: 400 instead expected a 2xx successful status code" output="Prometheus remote write"

running (0m41.0s), 00/05 VUs, 205 complete and 0 interrupted iterations
queries   [  14% ] 00/05 VUs  0m41.0s/5m0s  5.00 iters/s

running (0m42.0s), 00/05 VUs, 210 complete and 0 interrupted iterations
queries   [  14% ] 00/05 VUs  0m42.0s/5m0s  5.00 iters/s

running (0m43.0s), 00/05 VUs, 215 complete and 0 interrupted iterations
queries   [  14% ] 00/05 VUs  0m43.0s/5m0s  5.00 iters/s

running (0m44.0s), 00/05 VUs, 220 complete and 0 interrupted iterations
queries   [  15% ] 00/05 VUs  0m44.0s/5m0s  5.00 iters/s

running (0m45.0s), 00/05 VUs, 225 complete and 0 interrupted iterations
queries   [  15% ] 00/05 VUs  0m45.0s/5m0s  5.00 iters/s
time="2026-01-02T15:44:02Z" level=error msg="Failed to send the time series data to the endpoint" error="got status code: 400 instead expected a 2xx successful status code" output="Prometheus remote write"

running (0m46.0s), 00/05 VUs, 230 complete and 0 interrupted iterations
queries   [  15% ] 00/05 VUs  0m46.0s/5m0s  5.00 iters/s

running (0m47.0s), 00/05 VUs, 235 complete and 0 interrupted iterations
queries   [  16% ] 00/05 VUs  0m47.0s/5m0s  5.00 iters/s

running (0m48.0s), 00/05 VUs, 240 complete and 0 interrupted iterations
queries   [  16% ] 00/05 VUs  0m48.0s/5m0s  5.00 iters/s

running (0m49.0s), 00/05 VUs, 245 complete and 0 interrupted iterations
queries   [  16% ] 00/05 VUs  0m49.0s/5m0s  5.00 iters/s

running (0m50.0s), 00/05 VUs, 250 complete and 0 interrupted iterations
queries   [  17% ] 00/05 VUs  0m50.0s/5m0s  5.00 iters/s
time="2026-01-02T15:44:07Z" level=error msg="Failed to send the time series data to the endpoint" error="got status code: 400 instead expected a 2xx successful status code" output="Prometheus remote write"

running (0m51.0s), 00/05 VUs, 255 complete and 0 interrupted iterations
queries   [  17% ] 00/05 VUs  0m51.0s/5m0s  5.00 iters/s

running (0m52.0s), 00/05 VUs, 260 complete and 0 interrupted iterations
queries   [  17% ] 00/05 VUs  0m52.0s/5m0s  5.00 iters/s

running (0m53.0s), 00/05 VUs, 265 complete and 0 interrupted iterations
queries   [  18% ] 00/05 VUs  0m53.0s/5m0s  5.00 iters/s

running (0m54.0s), 00/05 VUs, 270 complete and 0 interrupted iterations
queries   [  18% ] 00/05 VUs  0m54.0s/5m0s  5.00 iters/s

running (0m55.0s), 00/05 VUs, 275 complete and 0 interrupted iterations
queries   [  18% ] 00/05 VUs  0m55.0s/5m0s  5.00 iters/s
time="2026-01-02T15:44:12Z" level=error msg="Failed to send the time series data to the endpoint" error="read tcp 10.217.1.148:44462->10.217.5.249:9091: read: connection reset by peer" output="Prometheus remote write"

running (0m56.0s), 00/05 VUs, 280 complete and 0 interrupted iterations
queries   [  19% ] 00/05 VUs  0m56.0s/5m0s  5.00 iters/s

running (0m57.0s), 00/05 VUs, 285 complete and 0 interrupted iterations
queries   [  19% ] 00/05 VUs  0m57.0s/5m0s  5.00 iters/s

running (0m58.0s), 00/05 VUs, 290 complete and 0 interrupted iterations
queries   [  19% ] 00/05 VUs  0m58.0s/5m0s  5.00 iters/s

running (0m59.0s), 00/05 VUs, 295 complete and 0 interrupted iterations
queries   [  20% ] 00/05 VUs  0m59.0s/5m0s  5.00 iters/s

running (1m00.0s), 00/05 VUs, 300 complete and 0 interrupted iterations
queries   [  20% ] 00/05 VUs  1m00.0s/5m0s  5.00 iters/s
time="2026-01-02T15:44:17Z" level=error msg="Failed to send the time series data to the endpoint" error="got status code: 400 instead expected a 2xx successful status code" output="Prometheus remote write"

running (1m01.0s), 00/05 VUs, 305 complete and 0 interrupted iterations
queries   [  20% ] 00/05 VUs  1m01.0s/5m0s  5.00 iters/s

running (1m02.0s), 00/05 VUs, 310 complete and 0 interrupted iterations
queries   [  21% ] 00/05 VUs  1m02.0s/5m0s  5.00 iters/s

running (1m03.0s), 00/05 VUs, 315 complete and 0 interrupted iterations
queries   [  21% ] 00/05 VUs  1m03.0s/5m0s  5.00 iters/s

running (1m04.0s), 00/05 VUs, 320 complete and 0 interrupted iterations
queries   [  21% ] 00/05 VUs  1m04.0s/5m0s  5.00 iters/s

running (1m05.0s), 00/05 VUs, 325 complete and 0 interrupted iterations
queries   [  22% ] 00/05 VUs  1m05.0s/5m0s  5.00 iters/s
time="2026-01-02T15:44:22Z" level=error msg="Failed to send the time series data to the endpoint" error="got status code: 400 instead expected a 2xx successful status code" output="Prometheus remote write"

running (1m06.0s), 00/05 VUs, 330 complete and 0 interrupted iterations
queries   [  22% ] 00/05 VUs  1m06.0s/5m0s  5.00 iters/s

running (1m07.0s), 00/05 VUs, 335 complete and 0 interrupted iterations
queries   [  22% ] 00/05 VUs  1m07.0s/5m0s  5.00 iters/s

running (1m08.0s), 00/05 VUs, 340 complete and 0 interrupted iterations
queries   [  23% ] 00/05 VUs  1m08.0s/5m0s  5.00 iters/s

running (1m09.0s), 00/05 VUs, 345 complete and 0 interrupted iterations
queries   [  23% ] 00/05 VUs  1m09.0s/5m0s  5.00 iters/s

running (1m10.0s), 00/05 VUs, 350 complete and 0 interrupted iterations
queries   [  23% ] 00/05 VUs  1m10.0s/5m0s  5.00 iters/s
time="2026-01-02T15:44:27Z" level=error msg="Failed to send the time series data to the endpoint" error="got status code: 400 instead expected a 2xx successful status code" output="Prometheus remote write"

running (1m11.0s), 00/05 VUs, 355 complete and 0 interrupted iterations
queries   [  24% ] 00/05 VUs  1m11.0s/5m0s  5.00 iters/s

running (1m12.0s), 00/05 VUs, 360 complete and 0 interrupted iterations
queries   [  24% ] 00/05 VUs  1m12.0s/5m0s  5.00 iters/s

running (1m13.0s), 00/05 VUs, 365 complete and 0 interrupted iterations
queries   [  24% ] 00/05 VUs  1m13.0s/5m0s  5.00 iters/s

running (1m14.0s), 00/05 VUs, 370 complete and 0 interrupted iterations
queries   [  25% ] 00/05 VUs  1m14.0s/5m0s  5.00 iters/s

running (1m15.0s), 00/05 VUs, 375 complete and 0 interrupted iterations
queries   [  25% ] 00/05 VUs  1m15.0s/5m0s  5.00 iters/s
time="2026-01-02T15:44:32Z" level=error msg="Failed to send the time series data to the endpoint" error="got status code: 400 instead expected a 2xx successful status code" output="Prometheus remote write"

running (1m16.0s), 00/05 VUs, 380 complete and 0 interrupted iterations
queries   [  25% ] 00/05 VUs  1m16.0s/5m0s  5.00 iters/s

running (1m17.0s), 00/05 VUs, 385 complete and 0 interrupted iterations
queries   [  26% ] 00/05 VUs  1m17.0s/5m0s  5.00 iters/s

running (1m18.0s), 00/05 VUs, 390 complete and 0 interrupted iterations
queries   [  26% ] 00/05 VUs  1m18.0s/5m0s  5.00 iters/s

running (1m19.0s), 00/05 VUs, 395 complete and 0 interrupted iterations
queries   [  26% ] 00/05 VUs  1m19.0s/5m0s  5.00 iters/s

running (1m20.0s), 00/05 VUs, 400 complete and 0 interrupted iterations
queries   [  27% ] 00/05 VUs  1m20.0s/5m0s  5.00 iters/s
time="2026-01-02T15:44:37Z" level=error msg="Failed to send the time series data to the endpoint" error="got status code: 400 instead expected a 2xx successful status code" output="Prometheus remote write"

running (1m21.0s), 00/05 VUs, 405 complete and 0 interrupted iterations
queries   [  27% ] 00/05 VUs  1m21.0s/5m0s  5.00 iters/s

running (1m22.0s), 00/05 VUs, 410 complete and 0 interrupted iterations
queries   [  27% ] 00/05 VUs  1m22.0s/5m0s  5.00 iters/s

running (1m23.0s), 00/05 VUs, 415 complete and 0 interrupted iterations
queries   [  28% ] 00/05 VUs  1m23.0s/5m0s  5.00 iters/s

running (1m24.0s), 00/05 VUs, 420 complete and 0 interrupted iterations
queries   [  28% ] 00/05 VUs  1m24.0s/5m0s  5.00 iters/s

running (1m25.0s), 00/05 VUs, 425 complete and 0 interrupted iterations
queries   [  28% ] 00/05 VUs  1m25.0s/5m0s  5.00 iters/s
time="2026-01-02T15:44:42Z" level=error msg="Failed to send the time series data to the endpoint" error="got status code: 400 instead expected a 2xx successful status code" output="Prometheus remote write"

running (1m26.0s), 00/05 VUs, 430 complete and 0 interrupted iterations
queries   [  29% ] 00/05 VUs  1m26.0s/5m0s  5.00 iters/s

running (1m27.0s), 00/05 VUs, 435 complete and 0 interrupted iterations
queries   [  29% ] 00/05 VUs  1m27.0s/5m0s  5.00 iters/s

running (1m28.0s), 00/05 VUs, 440 complete and 0 interrupted iterations
queries   [  29% ] 00/05 VUs  1m28.0s/5m0s  5.00 iters/s

running (1m29.0s), 00/05 VUs, 445 complete and 0 interrupted iterations
queries   [  30% ] 00/05 VUs  1m29.0s/5m0s  5.00 iters/s

running (1m30.0s), 00/05 VUs, 450 complete and 0 interrupted iterations
queries   [  30% ] 00/05 VUs  1m30.0s/5m0s  5.00 iters/s
time="2026-01-02T15:44:47Z" level=error msg="Failed to send the time series data to the endpoint" error="got status code: 400 instead expected a 2xx successful status code" output="Prometheus remote write"

running (1m31.0s), 00/05 VUs, 455 complete and 0 interrupted iterations
queries   [  30% ] 00/05 VUs  1m31.0s/5m0s  5.00 iters/s

running (1m32.0s), 00/05 VUs, 460 complete and 0 interrupted iterations
queries   [  31% ] 00/05 VUs  1m32.0s/5m0s  5.00 iters/s

running (1m33.0s), 00/05 VUs, 465 complete and 0 interrupted iterations
queries   [  31% ] 00/05 VUs  1m33.0s/5m0s  5.00 iters/s

running (1m34.0s), 00/05 VUs, 470 complete and 0 interrupted iterations
queries   [  31% ] 00/05 VUs  1m34.0s/5m0s  5.00 iters/s

running (1m35.0s), 00/05 VUs, 475 complete and 0 interrupted iterations
queries   [  32% ] 00/05 VUs  1m35.0s/5m0s  5.00 iters/s
time="2026-01-02T15:44:52Z" level=error msg="Failed to send the time series data to the endpoint" error="got status code: 400 instead expected a 2xx successful status code" output="Prometheus remote write"

running (1m36.0s), 00/05 VUs, 480 complete and 0 interrupted iterations
queries   [  32% ] 00/05 VUs  1m36.0s/5m0s  5.00 iters/s

running (1m37.0s), 00/05 VUs, 485 complete and 0 interrupted iterations
queries   [  32% ] 00/05 VUs  1m37.0s/5m0s  5.00 iters/s

running (1m38.0s), 00/05 VUs, 490 complete and 0 interrupted iterations
queries   [  33% ] 00/05 VUs  1m38.0s/5m0s  5.00 iters/s

running (1m39.0s), 00/05 VUs, 495 complete and 0 interrupted iterations
queries   [  33% ] 00/05 VUs  1m39.0s/5m0s  5.00 iters/s

running (1m40.0s), 00/05 VUs, 500 complete and 0 interrupted iterations
queries   [  33% ] 00/05 VUs  1m40.0s/5m0s  5.00 iters/s
time="2026-01-02T15:44:57Z" level=error msg="Failed to send the time series data to the endpoint" error="got status code: 400 instead expected a 2xx successful status code" output="Prometheus remote write"

running (1m41.0s), 00/05 VUs, 505 complete and 0 interrupted iterations
queries   [  34% ] 00/05 VUs  1m41.0s/5m0s  5.00 iters/s

running (1m42.0s), 00/05 VUs, 510 complete and 0 interrupted iterations
queries   [  34% ] 00/05 VUs  1m42.0s/5m0s  5.00 iters/s

running (1m43.0s), 00/05 VUs, 515 complete and 0 interrupted iterations
queries   [  34% ] 00/05 VUs  1m43.0s/5m0s  5.00 iters/s

running (1m44.0s), 00/05 VUs, 520 complete and 0 interrupted iterations
queries   [  35% ] 00/05 VUs  1m44.0s/5m0s  5.00 iters/s

running (1m45.0s), 00/05 VUs, 525 complete and 0 interrupted iterations
queries   [  35% ] 00/05 VUs  1m45.0s/5m0s  5.00 iters/s
time="2026-01-02T15:45:02Z" level=error msg="Failed to send the time series data to the endpoint" error="got status code: 400 instead expected a 2xx successful status code" output="Prometheus remote write"

running (1m46.0s), 00/05 VUs, 530 complete and 0 interrupted iterations
queries   [  35% ] 00/05 VUs  1m46.0s/5m0s  5.00 iters/s

running (1m47.0s), 00/05 VUs, 535 complete and 0 interrupted iterations
queries   [  36% ] 00/05 VUs  1m47.0s/5m0s  5.00 iters/s

running (1m48.0s), 00/05 VUs, 540 complete and 0 interrupted iterations
queries   [  36% ] 00/05 VUs  1m48.0s/5m0s  5.00 iters/s

running (1m49.0s), 00/05 VUs, 545 complete and 0 interrupted iterations
queries   [  36% ] 00/05 VUs  1m49.0s/5m0s  5.00 iters/s

running (1m50.0s), 00/05 VUs, 550 complete and 0 interrupted iterations
queries   [  37% ] 00/05 VUs  1m50.0s/5m0s  5.00 iters/s
time="2026-01-02T15:45:07Z" level=error msg="Failed to send the time series data to the endpoint" error="got status code: 400 instead expected a 2xx successful status code" output="Prometheus remote write"

running (1m51.0s), 00/05 VUs, 555 complete and 0 interrupted iterations
queries   [  37% ] 00/05 VUs  1m51.0s/5m0s  5.00 iters/s

running (1m52.0s), 00/05 VUs, 560 complete and 0 interrupted iterations
queries   [  37% ] 00/05 VUs  1m52.0s/5m0s  5.00 iters/s

running (1m53.0s), 00/05 VUs, 565 complete and 0 interrupted iterations
queries   [  38% ] 00/05 VUs  1m53.0s/5m0s  5.00 iters/s

running (1m54.0s), 00/05 VUs, 570 complete and 0 interrupted iterations
queries   [  38% ] 00/05 VUs  1m54.0s/5m0s  5.00 iters/s

running (1m55.0s), 00/05 VUs, 575 complete and 0 interrupted iterations
queries   [  38% ] 00/05 VUs  1m55.0s/5m0s  5.00 iters/s
time="2026-01-02T15:45:12Z" level=error msg="Failed to send the time series data to the endpoint" error="got status code: 400 instead expected a 2xx successful status code" output="Prometheus remote write"

running (1m56.0s), 00/05 VUs, 580 complete and 0 interrupted iterations
queries   [  39% ] 00/05 VUs  1m56.0s/5m0s  5.00 iters/s

running (1m57.0s), 00/05 VUs, 585 complete and 0 interrupted iterations
queries   [  39% ] 00/05 VUs  1m57.0s/5m0s  5.00 iters/s

running (1m58.0s), 00/05 VUs, 590 complete and 0 interrupted iterations
queries   [  39% ] 00/05 VUs  1m58.0s/5m0s  5.00 iters/s

running (1m59.0s), 00/05 VUs, 595 complete and 0 interrupted iterations
queries   [  40% ] 00/05 VUs  1m59.0s/5m0s  5.00 iters/s

running (2m00.0s), 00/05 VUs, 600 complete and 0 interrupted iterations
queries   [  40% ] 00/05 VUs  2m00.0s/5m0s  5.00 iters/s
time="2026-01-02T15:45:17Z" level=error msg="Failed to send the time series data to the endpoint" error="got status code: 400 instead expected a 2xx successful status code" output="Prometheus remote write"

running (2m01.0s), 00/05 VUs, 605 complete and 0 interrupted iterations
queries   [  40% ] 00/05 VUs  2m01.0s/5m0s  5.00 iters/s

running (2m02.0s), 00/05 VUs, 610 complete and 0 interrupted iterations
queries   [  41% ] 00/05 VUs  2m02.0s/5m0s  5.00 iters/s

running (2m03.0s), 00/05 VUs, 615 complete and 0 interrupted iterations
queries   [  41% ] 00/05 VUs  2m03.0s/5m0s  5.00 iters/s

running (2m04.0s), 00/05 VUs, 620 complete and 0 interrupted iterations
queries   [  41% ] 00/05 VUs  2m04.0s/5m0s  5.00 iters/s

running (2m05.0s), 00/05 VUs, 625 complete and 0 interrupted iterations
queries   [  42% ] 00/05 VUs  2m05.0s/5m0s  5.00 iters/s
time="2026-01-02T15:45:22Z" level=error msg="Failed to send the time series data to the endpoint" error="read tcp 10.217.1.148:43546->10.217.5.249:9091: read: connection reset by peer" output="Prometheus remote write"

running (2m06.0s), 00/05 VUs, 630 complete and 0 interrupted iterations
queries   [  42% ] 00/05 VUs  2m06.0s/5m0s  5.00 iters/s

running (2m07.0s), 00/05 VUs, 635 complete and 0 interrupted iterations
queries   [  42% ] 00/05 VUs  2m07.0s/5m0s  5.00 iters/s

running (2m08.0s), 00/05 VUs, 640 complete and 0 interrupted iterations
queries   [  43% ] 00/05 VUs  2m08.0s/5m0s  5.00 iters/s

running (2m09.0s), 00/05 VUs, 645 complete and 0 interrupted iterations
queries   [  43% ] 00/05 VUs  2m09.0s/5m0s  5.00 iters/s

running (2m10.0s), 00/05 VUs, 650 complete and 0 interrupted iterations
queries   [  43% ] 00/05 VUs  2m10.0s/5m0s  5.00 iters/s
time="2026-01-02T15:45:27Z" level=error msg="Failed to send the time series data to the endpoint" error="got status code: 400 instead expected a 2xx successful status code" output="Prometheus remote write"

running (2m11.0s), 00/05 VUs, 655 complete and 0 interrupted iterations
queries   [  44% ] 00/05 VUs  2m11.0s/5m0s  5.00 iters/s

running (2m12.0s), 00/05 VUs, 660 complete and 0 interrupted iterations
queries   [  44% ] 00/05 VUs  2m12.0s/5m0s  5.00 iters/s

running (2m13.0s), 00/05 VUs, 665 complete and 0 interrupted iterations
queries   [  44% ] 00/05 VUs  2m13.0s/5m0s  5.00 iters/s

running (2m14.0s), 00/05 VUs, 670 complete and 0 interrupted iterations
queries   [  45% ] 00/05 VUs  2m14.0s/5m0s  5.00 iters/s

running (2m15.0s), 00/05 VUs, 675 complete and 0 interrupted iterations
queries   [  45% ] 00/05 VUs  2m15.0s/5m0s  5.00 iters/s
time="2026-01-02T15:45:32Z" level=error msg="Failed to send the time series data to the endpoint" error="got status code: 400 instead expected a 2xx successful status code" output="Prometheus remote write"

running (2m16.0s), 00/05 VUs, 680 complete and 0 interrupted iterations
queries   [  45% ] 00/05 VUs  2m16.0s/5m0s  5.00 iters/s

running (2m17.0s), 00/05 VUs, 685 complete and 0 interrupted iterations
queries   [  46% ] 00/05 VUs  2m17.0s/5m0s  5.00 iters/s

running (2m18.0s), 00/05 VUs, 690 complete and 0 interrupted iterations
queries   [  46% ] 00/05 VUs  2m18.0s/5m0s  5.00 iters/s

running (2m19.0s), 00/05 VUs, 695 complete and 0 interrupted iterations
queries   [  46% ] 00/05 VUs  2m19.0s/5m0s  5.00 iters/s

running (2m20.0s), 00/05 VUs, 700 complete and 0 interrupted iterations
queries   [  47% ] 00/05 VUs  2m20.0s/5m0s  5.00 iters/s
time="2026-01-02T15:45:37Z" level=error msg="Failed to send the time series data to the endpoint" error="got status code: 400 instead expected a 2xx successful status code" output="Prometheus remote write"

running (2m21.0s), 00/05 VUs, 705 complete and 0 interrupted iterations
queries   [  47% ] 00/05 VUs  2m21.0s/5m0s  5.00 iters/s

running (2m22.0s), 00/05 VUs, 710 complete and 0 interrupted iterations
queries   [  47% ] 00/05 VUs  2m22.0s/5m0s  5.00 iters/s

running (2m23.0s), 00/05 VUs, 715 complete and 0 interrupted iterations
queries   [  48% ] 00/05 VUs  2m23.0s/5m0s  5.00 iters/s

running (2m24.0s), 00/05 VUs, 720 complete and 0 interrupted iterations
queries   [  48% ] 00/05 VUs  2m24.0s/5m0s  5.00 iters/s

running (2m25.0s), 00/05 VUs, 725 complete and 0 interrupted iterations
queries   [  48% ] 00/05 VUs  2m25.0s/5m0s  5.00 iters/s
time="2026-01-02T15:45:42Z" level=error msg="Failed to send the time series data to the endpoint" error="got status code: 400 instead expected a 2xx successful status code" output="Prometheus remote write"

running (2m26.0s), 00/05 VUs, 730 complete and 0 interrupted iterations
queries   [  49% ] 00/05 VUs  2m26.0s/5m0s  5.00 iters/s

running (2m27.0s), 00/05 VUs, 735 complete and 0 interrupted iterations
queries   [  49% ] 00/05 VUs  2m27.0s/5m0s  5.00 iters/s

running (2m28.0s), 00/05 VUs, 740 complete and 0 interrupted iterations
queries   [  49% ] 00/05 VUs  2m28.0s/5m0s  5.00 iters/s

running (2m29.0s), 00/05 VUs, 745 complete and 0 interrupted iterations
queries   [  50% ] 00/05 VUs  2m29.0s/5m0s  5.00 iters/s

running (2m30.0s), 00/05 VUs, 750 complete and 0 interrupted iterations
queries   [  50% ] 00/05 VUs  2m30.0s/5m0s  5.00 iters/s
time="2026-01-02T15:45:47Z" level=error msg="Failed to send the time series data to the endpoint" error="read tcp 10.217.1.148:53498->10.217.5.249:9091: read: connection reset by peer" output="Prometheus remote write"

running (2m31.0s), 00/05 VUs, 755 complete and 0 interrupted iterations
queries   [  50% ] 00/05 VUs  2m31.0s/5m0s  5.00 iters/s

running (2m32.0s), 00/05 VUs, 760 complete and 0 interrupted iterations
queries   [  51% ] 00/05 VUs  2m32.0s/5m0s  5.00 iters/s

running (2m33.0s), 00/05 VUs, 765 complete and 0 interrupted iterations
queries   [  51% ] 00/05 VUs  2m33.0s/5m0s  5.00 iters/s

running (2m34.0s), 00/05 VUs, 770 complete and 0 interrupted iterations
queries   [  51% ] 00/05 VUs  2m34.0s/5m0s  5.00 iters/s

running (2m35.0s), 00/05 VUs, 775 complete and 0 interrupted iterations
queries   [  52% ] 00/05 VUs  2m35.0s/5m0s  5.00 iters/s
time="2026-01-02T15:45:52Z" level=error msg="Failed to send the time series data to the endpoint" error="read tcp 10.217.1.148:58328->10.217.5.249:9091: read: connection reset by peer" output="Prometheus remote write"

running (2m36.0s), 00/05 VUs, 780 complete and 0 interrupted iterations
queries   [  52% ] 00/05 VUs  2m36.0s/5m0s  5.00 iters/s

running (2m37.0s), 00/05 VUs, 785 complete and 0 interrupted iterations
queries   [  52% ] 00/05 VUs  2m37.0s/5m0s  5.00 iters/s

running (2m38.0s), 00/05 VUs, 790 complete and 0 interrupted iterations
queries   [  53% ] 00/05 VUs  2m38.0s/5m0s  5.00 iters/s

running (2m39.0s), 00/05 VUs, 795 complete and 0 interrupted iterations
queries   [  53% ] 00/05 VUs  2m39.0s/5m0s  5.00 iters/s

running (2m40.0s), 00/05 VUs, 800 complete and 0 interrupted iterations
queries   [  53% ] 00/05 VUs  2m40.0s/5m0s  5.00 iters/s
time="2026-01-02T15:45:57Z" level=error msg="Failed to send the time series data to the endpoint" error="got status code: 400 instead expected a 2xx successful status code" output="Prometheus remote write"

running (2m41.0s), 00/05 VUs, 805 complete and 0 interrupted iterations
queries   [  54% ] 00/05 VUs  2m41.0s/5m0s  5.00 iters/s

running (2m42.0s), 00/05 VUs, 810 complete and 0 interrupted iterations
queries   [  54% ] 00/05 VUs  2m42.0s/5m0s  5.00 iters/s

running (2m43.0s), 00/05 VUs, 815 complete and 0 interrupted iterations
queries   [  54% ] 00/05 VUs  2m43.0s/5m0s  5.00 iters/s

running (2m44.0s), 00/05 VUs, 820 complete and 0 interrupted iterations
queries   [  55% ] 00/05 VUs  2m44.0s/5m0s  5.00 iters/s

running (2m45.0s), 00/05 VUs, 825 complete and 0 interrupted iterations
queries   [  55% ] 00/05 VUs  2m45.0s/5m0s  5.00 iters/s
time="2026-01-02T15:46:02Z" level=error msg="Failed to send the time series data to the endpoint" error="got status code: 400 instead expected a 2xx successful status code" output="Prometheus remote write"

running (2m46.0s), 00/05 VUs, 830 complete and 0 interrupted iterations
queries   [  55% ] 00/05 VUs  2m46.0s/5m0s  5.00 iters/s

running (2m47.0s), 00/05 VUs, 835 complete and 0 interrupted iterations
queries   [  56% ] 00/05 VUs  2m47.0s/5m0s  5.00 iters/s

running (2m48.0s), 00/05 VUs, 840 complete and 0 interrupted iterations
queries   [  56% ] 00/05 VUs  2m48.0s/5m0s  5.00 iters/s

running (2m49.0s), 00/05 VUs, 845 complete and 0 interrupted iterations
queries   [  56% ] 00/05 VUs  2m49.0s/5m0s  5.00 iters/s

running (2m50.0s), 00/05 VUs, 850 complete and 0 interrupted iterations
queries   [  57% ] 00/05 VUs  2m50.0s/5m0s  5.00 iters/s
time="2026-01-02T15:46:07Z" level=error msg="Failed to send the time series data to the endpoint" error="got status code: 400 instead expected a 2xx successful status code" output="Prometheus remote write"

running (2m51.0s), 00/05 VUs, 855 complete and 0 interrupted iterations
queries   [  57% ] 00/05 VUs  2m51.0s/5m0s  5.00 iters/s

running (2m52.0s), 00/05 VUs, 860 complete and 0 interrupted iterations
queries   [  57% ] 00/05 VUs  2m52.0s/5m0s  5.00 iters/s

running (2m53.0s), 00/05 VUs, 865 complete and 0 interrupted iterations
queries   [  58% ] 00/05 VUs  2m53.0s/5m0s  5.00 iters/s

running (2m54.0s), 00/05 VUs, 870 complete and 0 interrupted iterations
queries   [  58% ] 00/05 VUs  2m54.0s/5m0s  5.00 iters/s

running (2m55.0s), 00/05 VUs, 875 complete and 0 interrupted iterations
queries   [  58% ] 00/05 VUs  2m55.0s/5m0s  5.00 iters/s
time="2026-01-02T15:46:12Z" level=error msg="Failed to send the time series data to the endpoint" error="got status code: 400 instead expected a 2xx successful status code" output="Prometheus remote write"

running (2m56.0s), 00/05 VUs, 880 complete and 0 interrupted iterations
queries   [  59% ] 00/05 VUs  2m56.0s/5m0s  5.00 iters/s

running (2m57.0s), 00/05 VUs, 885 complete and 0 interrupted iterations
queries   [  59% ] 00/05 VUs  2m57.0s/5m0s  5.00 iters/s

running (2m58.0s), 00/05 VUs, 890 complete and 0 interrupted iterations
queries   [  59% ] 00/05 VUs  2m58.0s/5m0s  5.00 iters/s

running (2m59.0s), 00/05 VUs, 895 complete and 0 interrupted iterations
queries   [  60% ] 00/05 VUs  2m59.0s/5m0s  5.00 iters/s

running (3m00.0s), 00/05 VUs, 900 complete and 0 interrupted iterations
queries   [  60% ] 00/05 VUs  3m00.0s/5m0s  5.00 iters/s
time="2026-01-02T15:46:17Z" level=error msg="Failed to send the time series data to the endpoint" error="got status code: 400 instead expected a 2xx successful status code" output="Prometheus remote write"

running (3m01.0s), 00/05 VUs, 905 complete and 0 interrupted iterations
queries   [  60% ] 00/05 VUs  3m01.0s/5m0s  5.00 iters/s

running (3m02.0s), 00/05 VUs, 910 complete and 0 interrupted iterations
queries   [  61% ] 00/05 VUs  3m02.0s/5m0s  5.00 iters/s

running (3m03.0s), 00/05 VUs, 915 complete and 0 interrupted iterations
queries   [  61% ] 00/05 VUs  3m03.0s/5m0s  5.00 iters/s

running (3m04.0s), 00/05 VUs, 920 complete and 0 interrupted iterations
queries   [  61% ] 00/05 VUs  3m04.0s/5m0s  5.00 iters/s

running (3m05.0s), 00/05 VUs, 925 complete and 0 interrupted iterations
queries   [  62% ] 00/05 VUs  3m05.0s/5m0s  5.00 iters/s
time="2026-01-02T15:46:22Z" level=error msg="Failed to send the time series data to the endpoint" error="got status code: 400 instead expected a 2xx successful status code" output="Prometheus remote write"

running (3m06.0s), 00/05 VUs, 930 complete and 0 interrupted iterations
queries   [  62% ] 00/05 VUs  3m06.0s/5m0s  5.00 iters/s

running (3m07.0s), 00/05 VUs, 935 complete and 0 interrupted iterations
queries   [  62% ] 00/05 VUs  3m07.0s/5m0s  5.00 iters/s

running (3m08.0s), 00/05 VUs, 940 complete and 0 interrupted iterations
queries   [  63% ] 00/05 VUs  3m08.0s/5m0s  5.00 iters/s

running (3m09.0s), 00/05 VUs, 945 complete and 0 interrupted iterations
queries   [  63% ] 00/05 VUs  3m09.0s/5m0s  5.00 iters/s

running (3m10.0s), 00/05 VUs, 950 complete and 0 interrupted iterations
queries   [  63% ] 00/05 VUs  3m10.0s/5m0s  5.00 iters/s
time="2026-01-02T15:46:27Z" level=error msg="Failed to send the time series data to the endpoint" error="read tcp 10.217.1.148:33366->10.217.5.249:9091: read: connection reset by peer" output="Prometheus remote write"

running (3m11.0s), 00/05 VUs, 955 complete and 0 interrupted iterations
queries   [  64% ] 00/05 VUs  3m11.0s/5m0s  5.00 iters/s

running (3m12.0s), 00/05 VUs, 960 complete and 0 interrupted iterations
queries   [  64% ] 00/05 VUs  3m12.0s/5m0s  5.00 iters/s

running (3m13.0s), 00/05 VUs, 965 complete and 0 interrupted iterations
queries   [  64% ] 00/05 VUs  3m13.0s/5m0s  5.00 iters/s

running (3m14.0s), 00/05 VUs, 970 complete and 0 interrupted iterations
queries   [  65% ] 00/05 VUs  3m14.0s/5m0s  5.00 iters/s

running (3m15.0s), 00/05 VUs, 975 complete and 0 interrupted iterations
queries   [  65% ] 00/05 VUs  3m15.0s/5m0s  5.00 iters/s
time="2026-01-02T15:46:32Z" level=error msg="Failed to send the time series data to the endpoint" error="got status code: 400 instead expected a 2xx successful status code" output="Prometheus remote write"

running (3m16.0s), 00/05 VUs, 980 complete and 0 interrupted iterations
queries   [  65% ] 00/05 VUs  3m16.0s/5m0s  5.00 iters/s

running (3m17.0s), 00/05 VUs, 985 complete and 0 interrupted iterations
queries   [  66% ] 00/05 VUs  3m17.0s/5m0s  5.00 iters/s

running (3m18.0s), 00/05 VUs, 990 complete and 0 interrupted iterations
queries   [  66% ] 00/05 VUs  3m18.0s/5m0s  5.00 iters/s

running (3m19.0s), 00/05 VUs, 995 complete and 0 interrupted iterations
queries   [  66% ] 00/05 VUs  3m19.0s/5m0s  5.00 iters/s

running (3m20.0s), 00/05 VUs, 1000 complete and 0 interrupted iterations
queries   [  67% ] 00/05 VUs  3m20.0s/5m0s  5.00 iters/s
time="2026-01-02T15:46:37Z" level=error msg="Failed to send the time series data to the endpoint" error="read tcp 10.217.1.148:42632->10.217.5.249:9091: read: connection reset by peer" output="Prometheus remote write"

running (3m21.0s), 00/05 VUs, 1005 complete and 0 interrupted iterations
queries   [  67% ] 00/05 VUs  3m21.0s/5m0s  5.00 iters/s

running (3m22.0s), 00/05 VUs, 1010 complete and 0 interrupted iterations
queries   [  67% ] 00/05 VUs  3m22.0s/5m0s  5.00 iters/s

running (3m23.0s), 00/05 VUs, 1015 complete and 0 interrupted iterations
queries   [  68% ] 00/05 VUs  3m23.0s/5m0s  5.00 iters/s

running (3m24.0s), 00/05 VUs, 1020 complete and 0 interrupted iterations
queries   [  68% ] 00/05 VUs  3m24.0s/5m0s  5.00 iters/s

running (3m25.0s), 00/05 VUs, 1025 complete and 0 interrupted iterations
queries   [  68% ] 00/05 VUs  3m25.0s/5m0s  5.00 iters/s
time="2026-01-02T15:46:42Z" level=error msg="Failed to send the time series data to the endpoint" error="got status code: 400 instead expected a 2xx successful status code" output="Prometheus remote write"

running (3m26.0s), 00/05 VUs, 1030 complete and 0 interrupted iterations
queries   [  69% ] 00/05 VUs  3m26.0s/5m0s  5.00 iters/s

running (3m27.0s), 00/05 VUs, 1035 complete and 0 interrupted iterations
queries   [  69% ] 00/05 VUs  3m27.0s/5m0s  5.00 iters/s

running (3m28.0s), 00/05 VUs, 1040 complete and 0 interrupted iterations
queries   [  69% ] 00/05 VUs  3m28.0s/5m0s  5.00 iters/s

running (3m29.0s), 00/05 VUs, 1045 complete and 0 interrupted iterations
queries   [  70% ] 00/05 VUs  3m29.0s/5m0s  5.00 iters/s

running (3m30.0s), 00/05 VUs, 1050 complete and 0 interrupted iterations
queries   [  70% ] 00/05 VUs  3m30.0s/5m0s  5.00 iters/s
time="2026-01-02T15:46:47Z" level=error msg="Failed to send the time series data to the endpoint" error="read tcp 10.217.1.148:38068->10.217.5.249:9091: read: connection reset by peer" output="Prometheus remote write"

running (3m31.0s), 00/05 VUs, 1055 complete and 0 interrupted iterations
queries   [  70% ] 00/05 VUs  3m31.0s/5m0s  5.00 iters/s

running (3m32.0s), 00/05 VUs, 1060 complete and 0 interrupted iterations
queries   [  71% ] 00/05 VUs  3m32.0s/5m0s  5.00 iters/s

running (3m33.0s), 00/05 VUs, 1065 complete and 0 interrupted iterations
queries   [  71% ] 00/05 VUs  3m33.0s/5m0s  5.00 iters/s

running (3m34.0s), 00/05 VUs, 1070 complete and 0 interrupted iterations
queries   [  71% ] 00/05 VUs  3m34.0s/5m0s  5.00 iters/s

running (3m35.0s), 00/05 VUs, 1075 complete and 0 interrupted iterations
queries   [  72% ] 00/05 VUs  3m35.0s/5m0s  5.00 iters/s
time="2026-01-02T15:46:52Z" level=error msg="Failed to send the time series data to the endpoint" error="got status code: 400 instead expected a 2xx successful status code" output="Prometheus remote write"

running (3m36.0s), 00/05 VUs, 1080 complete and 0 interrupted iterations
queries   [  72% ] 00/05 VUs  3m36.0s/5m0s  5.00 iters/s

running (3m37.0s), 00/05 VUs, 1085 complete and 0 interrupted iterations
queries   [  72% ] 00/05 VUs  3m37.0s/5m0s  5.00 iters/s

running (3m38.0s), 00/05 VUs, 1090 complete and 0 interrupted iterations
queries   [  73% ] 00/05 VUs  3m38.0s/5m0s  5.00 iters/s

running (3m39.0s), 00/05 VUs, 1095 complete and 0 interrupted iterations
queries   [  73% ] 00/05 VUs  3m39.0s/5m0s  5.00 iters/s

running (3m40.0s), 00/05 VUs, 1100 complete and 0 interrupted iterations
queries   [  73% ] 00/05 VUs  3m40.0s/5m0s  5.00 iters/s
time="2026-01-02T15:46:57Z" level=error msg="Failed to send the time series data to the endpoint" error="got status code: 400 instead expected a 2xx successful status code" output="Prometheus remote write"

running (3m41.0s), 00/05 VUs, 1105 complete and 0 interrupted iterations
queries   [  74% ] 00/05 VUs  3m41.0s/5m0s  5.00 iters/s

running (3m42.0s), 00/05 VUs, 1110 complete and 0 interrupted iterations
queries   [  74% ] 00/05 VUs  3m42.0s/5m0s  5.00 iters/s

running (3m43.0s), 00/05 VUs, 1115 complete and 0 interrupted iterations
queries   [  74% ] 00/05 VUs  3m43.0s/5m0s  5.00 iters/s

running (3m44.0s), 00/05 VUs, 1120 complete and 0 interrupted iterations
queries   [  75% ] 00/05 VUs  3m44.0s/5m0s  5.00 iters/s

running (3m45.0s), 00/05 VUs, 1125 complete and 0 interrupted iterations
queries   [  75% ] 00/05 VUs  3m45.0s/5m0s  5.00 iters/s
time="2026-01-02T15:47:02Z" level=error msg="Failed to send the time series data to the endpoint" error="got status code: 400 instead expected a 2xx successful status code" output="Prometheus remote write"

running (3m46.0s), 00/05 VUs, 1130 complete and 0 interrupted iterations
queries   [  75% ] 00/05 VUs  3m46.0s/5m0s  5.00 iters/s

running (3m47.0s), 00/05 VUs, 1135 complete and 0 interrupted iterations
queries   [  76% ] 00/05 VUs  3m47.0s/5m0s  5.00 iters/s

running (3m48.0s), 00/05 VUs, 1140 complete and 0 interrupted iterations
queries   [  76% ] 00/05 VUs  3m48.0s/5m0s  5.00 iters/s

running (3m49.0s), 00/05 VUs, 1145 complete and 0 interrupted iterations
queries   [  76% ] 00/05 VUs  3m49.0s/5m0s  5.00 iters/s

running (3m50.0s), 00/05 VUs, 1150 complete and 0 interrupted iterations
queries   [  77% ] 00/05 VUs  3m50.0s/5m0s  5.00 iters/s
time="2026-01-02T15:47:07Z" level=error msg="Failed to send the time series data to the endpoint" error="got status code: 400 instead expected a 2xx successful status code" output="Prometheus remote write"

running (3m51.0s), 00/05 VUs, 1155 complete and 0 interrupted iterations
queries   [  77% ] 00/05 VUs  3m51.0s/5m0s  5.00 iters/s

running (3m52.0s), 00/05 VUs, 1160 complete and 0 interrupted iterations
queries   [  77% ] 00/05 VUs  3m52.0s/5m0s  5.00 iters/s

running (3m53.0s), 00/05 VUs, 1165 complete and 0 interrupted iterations
queries   [  78% ] 00/05 VUs  3m53.0s/5m0s  5.00 iters/s

running (3m54.0s), 00/05 VUs, 1170 complete and 0 interrupted iterations
queries   [  78% ] 00/05 VUs  3m54.0s/5m0s  5.00 iters/s

running (3m55.0s), 00/05 VUs, 1175 complete and 0 interrupted iterations
queries   [  78% ] 00/05 VUs  3m55.0s/5m0s  5.00 iters/s
time="2026-01-02T15:47:12Z" level=error msg="Failed to send the time series data to the endpoint" error="got status code: 400 instead expected a 2xx successful status code" output="Prometheus remote write"

running (3m56.0s), 00/05 VUs, 1180 complete and 0 interrupted iterations
queries   [  79% ] 00/05 VUs  3m56.0s/5m0s  5.00 iters/s

running (3m57.0s), 00/05 VUs, 1185 complete and 0 interrupted iterations
queries   [  79% ] 00/05 VUs  3m57.0s/5m0s  5.00 iters/s

running (3m58.0s), 00/05 VUs, 1190 complete and 0 interrupted iterations
queries   [  79% ] 00/05 VUs  3m58.0s/5m0s  5.00 iters/s

running (3m59.0s), 00/05 VUs, 1195 complete and 0 interrupted iterations
queries   [  80% ] 00/05 VUs  3m59.0s/5m0s  5.00 iters/s

running (4m00.0s), 00/05 VUs, 1200 complete and 0 interrupted iterations
queries   [  80% ] 00/05 VUs  4m00.0s/5m0s  5.00 iters/s
time="2026-01-02T15:47:17Z" level=error msg="Failed to send the time series data to the endpoint" error="got status code: 400 instead expected a 2xx successful status code" output="Prometheus remote write"

running (4m01.0s), 00/05 VUs, 1205 complete and 0 interrupted iterations
queries   [  80% ] 00/05 VUs  4m01.0s/5m0s  5.00 iters/s

running (4m02.0s), 00/05 VUs, 1210 complete and 0 interrupted iterations
queries   [  81% ] 00/05 VUs  4m02.0s/5m0s  5.00 iters/s

running (4m03.0s), 00/05 VUs, 1215 complete and 0 interrupted iterations
queries   [  81% ] 00/05 VUs  4m03.0s/5m0s  5.00 iters/s

running (4m04.0s), 00/05 VUs, 1220 complete and 0 interrupted iterations
queries   [  81% ] 00/05 VUs  4m04.0s/5m0s  5.00 iters/s

running (4m05.0s), 00/05 VUs, 1225 complete and 0 interrupted iterations
queries   [  82% ] 00/05 VUs  4m05.0s/5m0s  5.00 iters/s
time="2026-01-02T15:47:22Z" level=error msg="Failed to send the time series data to the endpoint" error="got status code: 400 instead expected a 2xx successful status code" output="Prometheus remote write"

running (4m06.0s), 00/05 VUs, 1230 complete and 0 interrupted iterations
queries   [  82% ] 00/05 VUs  4m06.0s/5m0s  5.00 iters/s

running (4m07.0s), 00/05 VUs, 1235 complete and 0 interrupted iterations
queries   [  82% ] 00/05 VUs  4m07.0s/5m0s  5.00 iters/s

running (4m08.0s), 00/05 VUs, 1240 complete and 0 interrupted iterations
queries   [  83% ] 00/05 VUs  4m08.0s/5m0s  5.00 iters/s

running (4m09.0s), 00/05 VUs, 1245 complete and 0 interrupted iterations
queries   [  83% ] 00/05 VUs  4m09.0s/5m0s  5.00 iters/s

running (4m10.0s), 00/05 VUs, 1250 complete and 0 interrupted iterations
queries   [  83% ] 00/05 VUs  4m10.0s/5m0s  5.00 iters/s
time="2026-01-02T15:47:27Z" level=error msg="Failed to send the time series data to the endpoint" error="got status code: 400 instead expected a 2xx successful status code" output="Prometheus remote write"

running (4m11.0s), 00/05 VUs, 1255 complete and 0 interrupted iterations
queries   [  84% ] 00/05 VUs  4m11.0s/5m0s  5.00 iters/s

running (4m12.0s), 00/05 VUs, 1260 complete and 0 interrupted iterations
queries   [  84% ] 00/05 VUs  4m12.0s/5m0s  5.00 iters/s

running (4m13.0s), 00/05 VUs, 1265 complete and 0 interrupted iterations
queries   [  84% ] 00/05 VUs  4m13.0s/5m0s  5.00 iters/s

running (4m14.0s), 00/05 VUs, 1270 complete and 0 interrupted iterations
queries   [  85% ] 00/05 VUs  4m14.0s/5m0s  5.00 iters/s

running (4m15.0s), 00/05 VUs, 1275 complete and 0 interrupted iterations
queries   [  85% ] 00/05 VUs  4m15.0s/5m0s  5.00 iters/s
time="2026-01-02T15:47:32Z" level=error msg="Failed to send the time series data to the endpoint" error="read tcp 10.217.1.148:59474->10.217.5.249:9091: read: connection reset by peer" output="Prometheus remote write"

running (4m16.0s), 00/05 VUs, 1280 complete and 0 interrupted iterations
queries   [  85% ] 00/05 VUs  4m16.0s/5m0s  5.00 iters/s

running (4m17.0s), 00/05 VUs, 1285 complete and 0 interrupted iterations
queries   [  86% ] 00/05 VUs  4m17.0s/5m0s  5.00 iters/s

running (4m18.0s), 00/05 VUs, 1290 complete and 0 interrupted iterations
queries   [  86% ] 00/05 VUs  4m18.0s/5m0s  5.00 iters/s

running (4m19.0s), 00/05 VUs, 1295 complete and 0 interrupted iterations
queries   [  86% ] 00/05 VUs  4m19.0s/5m0s  5.00 iters/s

running (4m20.0s), 00/05 VUs, 1300 complete and 0 interrupted iterations
queries   [  87% ] 00/05 VUs  4m20.0s/5m0s  5.00 iters/s
time="2026-01-02T15:47:37Z" level=error msg="Failed to send the time series data to the endpoint" error="got status code: 400 instead expected a 2xx successful status code" output="Prometheus remote write"

running (4m21.0s), 00/05 VUs, 1305 complete and 0 interrupted iterations
queries   [  87% ] 00/05 VUs  4m21.0s/5m0s  5.00 iters/s

running (4m22.0s), 00/05 VUs, 1310 complete and 0 interrupted iterations
queries   [  87% ] 00/05 VUs  4m22.0s/5m0s  5.00 iters/s

running (4m23.0s), 00/05 VUs, 1315 complete and 0 interrupted iterations
queries   [  88% ] 00/05 VUs  4m23.0s/5m0s  5.00 iters/s

running (4m24.0s), 00/05 VUs, 1320 complete and 0 interrupted iterations
queries   [  88% ] 00/05 VUs  4m24.0s/5m0s  5.00 iters/s

running (4m25.0s), 00/05 VUs, 1325 complete and 0 interrupted iterations
queries   [  88% ] 00/05 VUs  4m25.0s/5m0s  5.00 iters/s
time="2026-01-02T15:47:42Z" level=error msg="Failed to send the time series data to the endpoint" error="got status code: 400 instead expected a 2xx successful status code" output="Prometheus remote write"

running (4m26.0s), 00/05 VUs, 1330 complete and 0 interrupted iterations
queries   [  89% ] 00/05 VUs  4m26.0s/5m0s  5.00 iters/s

running (4m27.0s), 00/05 VUs, 1335 complete and 0 interrupted iterations
queries   [  89% ] 00/05 VUs  4m27.0s/5m0s  5.00 iters/s

running (4m28.0s), 00/05 VUs, 1340 complete and 0 interrupted iterations
queries   [  89% ] 00/05 VUs  4m28.0s/5m0s  5.00 iters/s

running (4m29.0s), 00/05 VUs, 1345 complete and 0 interrupted iterations
queries   [  90% ] 00/05 VUs  4m29.0s/5m0s  5.00 iters/s

running (4m30.0s), 00/05 VUs, 1350 complete and 0 interrupted iterations
queries   [  90% ] 00/05 VUs  4m30.0s/5m0s  5.00 iters/s
time="2026-01-02T15:47:47Z" level=error msg="Failed to send the time series data to the endpoint" error="got status code: 400 instead expected a 2xx successful status code" output="Prometheus remote write"

running (4m31.0s), 00/05 VUs, 1355 complete and 0 interrupted iterations
queries   [  90% ] 00/05 VUs  4m31.0s/5m0s  5.00 iters/s

running (4m32.0s), 00/05 VUs, 1360 complete and 0 interrupted iterations
queries   [  91% ] 00/05 VUs  4m32.0s/5m0s  5.00 iters/s

running (4m33.0s), 00/05 VUs, 1365 complete and 0 interrupted iterations
queries   [  91% ] 00/05 VUs  4m33.0s/5m0s  5.00 iters/s

running (4m34.0s), 00/05 VUs, 1370 complete and 0 interrupted iterations
queries   [  91% ] 00/05 VUs  4m34.0s/5m0s  5.00 iters/s

running (4m35.0s), 00/05 VUs, 1375 complete and 0 interrupted iterations
queries   [  92% ] 00/05 VUs  4m35.0s/5m0s  5.00 iters/s
time="2026-01-02T15:47:52Z" level=error msg="Failed to send the time series data to the endpoint" error="got status code: 400 instead expected a 2xx successful status code" output="Prometheus remote write"

running (4m36.0s), 00/05 VUs, 1380 complete and 0 interrupted iterations
queries   [  92% ] 00/05 VUs  4m36.0s/5m0s  5.00 iters/s

running (4m37.0s), 00/05 VUs, 1385 complete and 0 interrupted iterations
queries   [  92% ] 00/05 VUs  4m37.0s/5m0s  5.00 iters/s

running (4m38.0s), 00/05 VUs, 1390 complete and 0 interrupted iterations
queries   [  93% ] 00/05 VUs  4m38.0s/5m0s  5.00 iters/s

running (4m39.0s), 00/05 VUs, 1395 complete and 0 interrupted iterations
queries   [  93% ] 00/05 VUs  4m39.0s/5m0s  5.00 iters/s

running (4m40.0s), 00/05 VUs, 1400 complete and 0 interrupted iterations
queries   [  93% ] 00/05 VUs  4m40.0s/5m0s  5.00 iters/s
time="2026-01-02T15:47:57Z" level=error msg="Failed to send the time series data to the endpoint" error="got status code: 400 instead expected a 2xx successful status code" output="Prometheus remote write"

running (4m41.0s), 00/05 VUs, 1405 complete and 0 interrupted iterations
queries   [  94% ] 00/05 VUs  4m41.0s/5m0s  5.00 iters/s

running (4m42.0s), 00/05 VUs, 1410 complete and 0 interrupted iterations
queries   [  94% ] 00/05 VUs  4m42.0s/5m0s  5.00 iters/s

running (4m43.0s), 00/05 VUs, 1415 complete and 0 interrupted iterations
queries   [  94% ] 00/05 VUs  4m43.0s/5m0s  5.00 iters/s

running (4m44.0s), 00/05 VUs, 1420 complete and 0 interrupted iterations
queries   [  95% ] 00/05 VUs  4m44.0s/5m0s  5.00 iters/s

running (4m45.0s), 00/05 VUs, 1425 complete and 0 interrupted iterations
queries   [  95% ] 00/05 VUs  4m45.0s/5m0s  5.00 iters/s
time="2026-01-02T15:48:02Z" level=error msg="Failed to send the time series data to the endpoint" error="got status code: 400 instead expected a 2xx successful status code" output="Prometheus remote write"

running (4m46.0s), 00/05 VUs, 1430 complete and 0 interrupted iterations
queries   [  95% ] 00/05 VUs  4m46.0s/5m0s  5.00 iters/s

running (4m47.0s), 00/05 VUs, 1435 complete and 0 interrupted iterations
queries   [  96% ] 00/05 VUs  4m47.0s/5m0s  5.00 iters/s

running (4m48.0s), 00/05 VUs, 1440 complete and 0 interrupted iterations
queries   [  96% ] 00/05 VUs  4m48.0s/5m0s  5.00 iters/s

running (4m49.0s), 00/05 VUs, 1445 complete and 0 interrupted iterations
queries   [  96% ] 00/05 VUs  4m49.0s/5m0s  5.00 iters/s

running (4m50.0s), 00/05 VUs, 1450 complete and 0 interrupted iterations
queries   [  97% ] 00/05 VUs  4m50.0s/5m0s  5.00 iters/s
time="2026-01-02T15:48:07Z" level=error msg="Failed to send the time series data to the endpoint" error="got status code: 400 instead expected a 2xx successful status code" output="Prometheus remote write"

running (4m51.0s), 00/05 VUs, 1455 complete and 0 interrupted iterations
queries   [  97% ] 00/05 VUs  4m51.0s/5m0s  5.00 iters/s

running (4m52.0s), 00/05 VUs, 1460 complete and 0 interrupted iterations
queries   [  97% ] 00/05 VUs  4m52.0s/5m0s  5.00 iters/s

running (4m53.0s), 00/05 VUs, 1465 complete and 0 interrupted iterations
queries   [  98% ] 00/05 VUs  4m53.0s/5m0s  5.00 iters/s

running (4m54.0s), 00/05 VUs, 1470 complete and 0 interrupted iterations
queries   [  98% ] 00/05 VUs  4m54.0s/5m0s  5.00 iters/s

running (4m55.0s), 00/05 VUs, 1475 complete and 0 interrupted iterations
queries   [  98% ] 00/05 VUs  4m55.0s/5m0s  5.00 iters/s
time="2026-01-02T15:48:12Z" level=error msg="Failed to send the time series data to the endpoint" error="got status code: 400 instead expected a 2xx successful status code" output="Prometheus remote write"

running (4m56.0s), 00/05 VUs, 1480 complete and 0 interrupted iterations
queries   [  99% ] 00/05 VUs  4m56.0s/5m0s  5.00 iters/s

running (4m57.0s), 00/05 VUs, 1485 complete and 0 interrupted iterations
queries   [  99% ] 00/05 VUs  4m57.0s/5m0s  5.00 iters/s

running (4m58.0s), 00/05 VUs, 1490 complete and 0 interrupted iterations
queries   [  99% ] 00/05 VUs  4m58.0s/5m0s  5.00 iters/s

running (4m59.0s), 00/05 VUs, 1495 complete and 0 interrupted iterations
queries   [ 100% ] 00/05 VUs  4m59.0s/5m0s  5.00 iters/s

running (5m00.0s), 00/05 VUs, 1500 complete and 0 interrupted iterations
queries   [ 100% ] 00/05 VUs  5m00.0s/5m0s  5.00 iters/s
time="2026-01-02T15:48:17Z" level=error msg="Failed to send the time series data to the endpoint" error="got status code: 400 instead expected a 2xx successful status code" output="Prometheus remote write"
time="2026-01-02T15:48:17Z" level=info msg="\n================================================================================\n  TEST COMPLETE\n================================================================================\n  Check the k6 summary above for detailed metrics:\n  - tempo_query_duration_seconds: Query latency histogram\n  - tempo_query_requests_total: Total queries executed\n  - tempo_query_failures_total: Failed queries\n  - tempo_query_traces_returned: Traces returned per query\n================================================================================\n" source=console
time="2026-01-02T15:48:17Z" level=error msg="Failed to send the time series data to the endpoint" error="got status code: 400 instead expected a 2xx successful status code" output="Prometheus remote write"
time="2026-01-02T15:48:17Z" level=error msg="Stopping output 0 failed" component=output-manager error="marking time series as stale failed: read tcp 10.217.1.148:56006->10.217.5.249:9091: read: connection reset by peer"


  █ THRESHOLDS 

    tempo_query_failures_total
    ✓ 'rate<1' rate=0/s


  █ TOTAL RESULTS 

    CUSTOM
    tempo_query_failures_total...: 0    0/s

    EXECUTION
    iteration_duration...........: avg=11.86ms min=3.28ms med=11.39ms max=61.56ms p(90)=18.55ms p(95)=21.55ms
    iterations...................: 1500 4.999975/s
    vus..........................: 0    min=0      max=1
    vus_max......................: 5    min=5      max=5

    NETWORK
    data_received................: 0 B  0 B/s
    data_sent....................: 0 B  0 B/s




running (5m00.0s), 00/05 VUs, 1500 complete and 0 interrupted iterations
queries ✓ [ 100% ] 00/05 VUs  5m0s  5.00 iters/s
===K6_SUMMARY_JSON_START===
{
    "root_group": {
        "name": "",
        "path": "",
        "id": "d41d8cd98f00b204e9800998ecf8427e",
        "groups": {},
        "checks": {}
    },
    "metrics": {
        "vus": {
            "value": 0,
            "min": 0,
            "max": 1
        },
        "vus_max": {
            "value": 5,
            "min": 5,
            "max": 5
        },
        "tempo_query_failures_total": {
            "count": 0,
            "rate": 0,
            "thresholds": {
                "rate<1": false
            }
        },
        "data_sent": {
            "count": 0,
            "rate": 0
        },
        "data_received": {
            "count": 0,
            "rate": 0
        },
        "iteration_duration": {
            "min": 3.280112,
            "med": 11.394329500000001,
            "max": 61.565623,
            "p(90)": 18.5571249,
            "p(95)": 21.557783549999996,
            "avg": 11.860179418666672
        },
        "iterations": {
            "count": 1500,
            "rate": 4.999974575579281
        }
    },
    "setup_data": {}
}===K6_SUMMARY_JSON_END===
